Electricity: Total (MBtu),43.04985360463087
Electricity: Net (MBtu),43.04985360463087
Natural Gas: Total (MBtu),55.73164667442305
Other Fuels: Total (MBtu),0.0
"",""
Electricity: Heating (MBtu),0.0
Electricity: Cooling (MBtu),2.161023034314363
Electricity: Fans/Pumps (MBtu),2.9951021001900826
Electricity: Hot Water (MBtu),11.468587155791138
Electricity: Lighting (MBtu),8.852611903726384
Electricity: Mech Vent (MBtu),0.0
Electricity: Refrigerator (MBtu),2.36006462958016
Electricity: Dishwasher (MBtu),0.5876466145942567
Electricity: Clothes Washer (MBtu),0.22747610887519612
Electricity: Clothes Dryer (MBtu),3.3173599210966103
Electricity: Range/Oven (MBtu),1.5259855637044408
Electricity: Ceiling Fan (MBtu),0
Electricity: Plug Loads (MBtu),9.553996572758237
Electricity: PV (MBtu),0.0
Natural Gas: Heating (MBtu),55.73164667442305
Natural Gas: Hot Water (MBtu),0.0
Natural Gas: Clothes Dryer (MBtu),0
Natural Gas: Range/Oven (MBtu),0
Other Fuels: Heating (MBtu),0.0
Other Fuels: Hot Water (MBtu),0.0
Other Fuels: Clothes Dryer (MBtu),0
Other Fuels: Range/Oven (MBtu),0
